student@student-OptiPlex-3050:~$ sudo mysql -u root -p
[sudo] password for student: 
Enter password: 
Welcome to the MariaDB monitor.  Commands end with ; or \g.
Your MariaDB connection id is 33
Server version: 10.0.38-MariaDB-0ubuntu0.16.04.1 Ubuntu 16.04

Copyright (c) 2000, 2018, Oracle, MariaDB Corporation Ab and others.

Type 'help;' or '\h' for help. Type '\c' to clear the current input statement.

MariaDB [(none)]> use db1
Reading table information for completion of table and column names
You can turn off this feature to get a quicker startup with -A

Database changed


MariaDB [db1]> create table employe(empno int,empname varchar(20),designation varchar(20),salary int,DOB date,deptno int);
Query OK, 0 rows affected (0.24 sec)

MariaDB [db1]> insert into employe values(1,'anjali','manager',30000,'10-03-1988',2);
Query OK, 1 row affected, 1 warning (0.02 sec)

MariaDB [db1]> insert into employe values(2,'rahul','analyst',20000,'03-10-1992',3);
Query OK, 1 row affected, 1 warning (0.03 sec)

MariaDB [db1]> insert into employe values(3,'swathi','clerk',10000,'23-12-1995',3);
Query OK, 1 row affected, 1 warning (0.03 sec)

MariaDB [db1]> insert into employe values(4,'anandhu','salesman',5000,'23-12-1995',6);
Query OK, 1 row affected, 1 warning (0.03 sec)

MariaDB [db1]> insert into employe values(5,'gokul','salesman',5000,'05-02-1998',6);
Query OK, 1 row affected, 1 warning (0.03 sec)

MariaDB [db1]> select * from employe;
+-------+---------+-------------+--------+------------+--------+
| empno | empname | designation | salary | DOB        | deptno |
+-------+---------+-------------+--------+------------+--------+
|     1 | anjali  | manager     |  30000 | 0000-00-00 |      2 |
|     2 | rahul   | analyst     |  20000 | 0000-00-00 |      3 |
|     3 | swathi  | clerk       |  10000 | 0000-00-00 |      3 |
|     4 | anandhu | salesman    |   5000 | 0000-00-00 |      6 |
|     5 | gokul   | salesman    |   5000 | 0000-00-00 |      6 |
+-------+---------+-------------+--------+------------+--------+
5 rows in set (0.00 sec)


MariaDB [db1]> select * from employe;
+-------+---------+-------------+--------+------------+--------+
| empno | empname | designation | salary | DOB        | deptno |
+-------+---------+-------------+--------+------------+--------+
|     1 | anjali  | manager     |  30000 | 0000-00-00 |      2 |
|     2 | rahul   | analyst     |  20000 | 0000-00-00 |      3 |
|     3 | swathi  | clerk       |  10000 | 0000-00-00 |      3 |
|     4 | anandhu | salesman    |   5000 | 0000-00-00 |      6 |
|     5 | gokul   | salesman    |   5000 | 0000-00-00 |      6 |
+-------+---------+-------------+--------+------------+--------+
5 rows in set (0.00 sec)

MariaDB [db1]> update employe set DOB='1998-03-10' where empno=1;
Query OK, 1 row affected (0.04 sec)
Rows matched: 1  Changed: 1  Warnings: 0

MariaDB [db1]> select * from employe;
+-------+---------+-------------+--------+------------+--------+
| empno | empname | designation | salary | DOB        | deptno |
+-------+---------+-------------+--------+------------+--------+
|     1 | anjali  | manager     |  30000 | 1998-03-10 |      2 |
|     2 | rahul   | analyst     |  20000 | 0000-00-00 |      3 |
|     3 | swathi  | clerk       |  10000 | 0000-00-00 |      3 |
|     4 | anandhu | salesman    |   5000 | 0000-00-00 |      6 |
|     5 | gokul   | salesman    |   5000 | 0000-00-00 |      6 |
+-------+---------+-------------+--------+------------+--------+
5 rows in set (0.00 sec)

MariaDB [db1]> update employe set DOB='1992-10-03' where empno=2;
Query OK, 1 row affected (0.04 sec)
Rows matched: 1  Changed: 1  Warnings: 0

MariaDB [db1]> update employe set DOB='1998-05-25' where empno=3;
Query OK, 1 row affected (0.03 sec)
Rows matched: 1  Changed: 1  Warnings: 0

MariaDB [db1]> update employe set DOB='1996-06-14' where empno=3;
Query OK, 1 row affected (0.03 sec)
Rows matched: 1  Changed: 1  Warnings: 0

MariaDB [db1]> update employe set DOB='1998-05-25' where empno=4;
Query OK, 1 row affected (0.04 sec)
Rows matched: 1  Changed: 1  Warnings: 0

MariaDB [db1]> select *from employe;
+-------+---------+-------------+--------+------------+--------+
| empno | empname | designation | salary | DOB        | deptno |
+-------+---------+-------------+--------+------------+--------+
|     1 | anjali  | manager     |  30000 | 1998-03-10 |      2 |
|     2 | rahul   | analyst     |  20000 | 1992-10-03 |      3 |
|     3 | swathi  | clerk       |  10000 | 1996-06-14 |      3 |
|     4 | anandhu | salesman    |   5000 | 1998-05-25 |      6 |
|     5 | gokul   | salesman    |   5000 | 0000-00-00 |      6 |
+-------+---------+-------------+--------+------------+--------+
5 rows in set (0.00 sec)

MariaDB [db1]> update employe set DOB='1999-12-23' where empno=5;
Query OK, 1 row affected (0.03 sec)
Rows matched: 1  Changed: 1  Warnings: 0

MariaDB [db1]> select *from employe;
+-------+---------+-------------+--------+------------+--------+
| empno | empname | designation | salary | DOB        | deptno |
+-------+---------+-------------+--------+------------+--------+
|     1 | anjali  | manager     |  30000 | 1998-03-10 |      2 |
|     2 | rahul   | analyst     |  20000 | 1992-10-03 |      3 |
|     3 | swathi  | clerk       |  10000 | 1996-06-14 |      3 |
|     4 | anandhu | salesman    |   5000 | 1998-05-25 |      6 |
|     5 | gokul   | salesman    |   5000 | 1999-12-23 |      6 |
+-------+---------+-------------+--------+------------+--------+
5 rows in set (0.00 sec)

MariaDB [db1]> select *from employe where salary>10000;
+-------+---------+-------------+--------+------------+--------+
| empno | empname | designation | salary | DOB        | deptno |
+-------+---------+-------------+--------+------------+--------+
|     1 | anjali  | manager     |  30000 | 1998-03-10 |      2 |
|     2 | rahul   | analyst     |  20000 | 1992-10-03 |      3 |
+-------+---------+-------------+--------+------------+--------+
2 rows in set (0.00 sec)


MariaDB [db1]> delete from employe where deptno=6;
Query OK, 2 rows affected (0.04 sec)

MariaDB [db1]> select *from employe;
+-------+---------+-------------+--------+------------+--------+
| empno | empname | designation | salary | DOB        | deptno |
+-------+---------+-------------+--------+------------+--------+
|     1 | anjali  | manager     |  30000 | 1998-03-10 |      2 |
|     2 | rahul   | analyst     |  20000 | 1992-10-03 |      3 |
|     3 | swathi  | clerk       |  10000 | 1996-06-14 |      3 |
+-------+---------+-------------+--------+------------+--------+
3 rows in set (0.00 sec)

MariaDB [db1]> update employe set salary=salary+5000 where designation='manager';
Query OK, 1 row affected (0.03 sec)
Rows matched: 1  Changed: 1  Warnings: 0

MariaDB [db1]> select *from employe;
+-------+---------+-------------+--------+------------+--------+
| empno | empname | designation | salary | DOB        | deptno |
+-------+---------+-------------+--------+------------+--------+
|     1 | anjali  | manager     |  35000 | 1998-03-10 |      2 |
|     2 | rahul   | analyst     |  20000 | 1992-10-03 |      3 |
|     3 | swathi  | clerk       |  10000 | 1996-06-14 |      3 |
+-------+---------+-------------+--------+------------+--------+
3 rows in set (0.00 sec)

MariaDB [db1]> select empname from employe order by empname;
+---------+
| empname |
+---------+
| anjali  |
| rahul   |
| swathi  |
+---------+
3 rows in set (0.00 sec)

MariaDB [db1]> truncate table employe;
Query OK, 0 rows affected (0.18 sec)

MariaDB [db1]> select *from employe;
Empty set (0.00 sec)



